{
  "schema_version": "1.0.0",

  "engagement": {
    "client_name": "Acme HVAC Services",
    "client_slug": "acme-hvac",
    "audit_date": "2026-04-27",
    "audit_version": 1,
    "next_rescore_date": "2026-10-27",
    "industry": "HVAC services",
    "revenue_band": "$3M-$5M",
    "tier_recommendation": "tier_2",
    "tier_recommendation_rationale": "Documented Strategy Coverage of 1/6 maps directly to the Tier 2 use case: producing documented strategy across all six areas in 30 days. Activity scores (24/60) suggest the work is happening but isn't a system. Tier 3 is the right destination once strategy is documented; Tier 2 is the bridge."
  },

  "scorecard": {
    "total_marketing_maturity": 24,
    "documented_strategy_coverage": 1,
    "areas": {
      "brand": {
        "activity_score": 5,
        "documented_strategy": "partial",
        "documented_strategy_elements": [
          { "name": "Positioning statement", "status": "stale", "evidence": "One-pager from 2022 found in shared drive; not referenced in current materials." },
          { "name": "Target audience definition", "status": "stale", "evidence": "Mentioned in old website draft; current site uses different phrasing." },
          { "name": "Brand voice and tone guide", "status": "missing", "evidence": "No documentation found; voice varies materially across email, social, and website." },
          { "name": "Differentiation statement", "status": "missing", "evidence": "Owner articulates clearly in interviews but it isn't written down anywhere." }
        ],
        "top_gap": "No documented voice or differentiation statement",
        "gap_narrative": "Brand activity is reasonable: a clean website, consistent visual identity, recognizable name in the local market. But the strategic substance behind the brand — voice, differentiation, audience — isn't documented. The owner can articulate the differentiation in conversation but can't hand it off. New marketing hires or vendors would be guessing. The 2022 positioning work has aged out without being refreshed.",
        "evidence": [
          "Intake interview: 'Honestly, I just told the web designer what felt right.'",
          "Materials review: positioning one-pager dated March 2022, no updates since.",
          "Asset crawl: website copy and email copy show divergent voice."
        ]
      },
      "customer": {
        "activity_score": 3,
        "documented_strategy": "none",
        "documented_strategy_elements": [
          { "name": "ICP definition (firmographic + behavioral)", "status": "missing", "evidence": "Not documented. Owner describes 'good customers' anecdotally." },
          { "name": "Primary persona", "status": "missing", "evidence": "No persona document exists." },
          { "name": "Acquisition strategy", "status": "missing", "evidence": "Lead sources are tracked in HubSpot but no documented strategy for which channels matter and why." },
          { "name": "Retention strategy", "status": "missing", "evidence": "No documented retention program. Service contracts are reactive, not strategic." },
          { "name": "Customer journey map", "status": "missing", "evidence": "No journey documentation exists." }
        ],
        "top_gap": "ICP undefined; no retention strategy",
        "gap_narrative": "Customer is the weakest area. Lead generation happens, but it's mostly inbound and undirected — referrals, Google search, occasional Facebook. There's no documented ICP, no persona, no acquisition strategy, no retention strategy. Service contracts auto-renew but aren't actively marketed. The owner has strong intuition about who the best customers are but none of it is captured. This is the area where Tier 2 will have the largest measurable impact.",
        "evidence": [
          "HubSpot review: 142 leads in last 12 months, 31 closed-won, no documented stage definitions.",
          "Intake: 'We don't really do retention marketing — they call us when something breaks.'"
        ]
      },
      "offering": {
        "activity_score": 7,
        "documented_strategy": "current",
        "documented_strategy_elements": [
          { "name": "Value proposition", "status": "current", "evidence": "Clearly articulated on website, in proposals, and in owner interview. Consistent." },
          { "name": "USP", "status": "current", "evidence": "Same-day service guarantee documented in service agreements and marketing." },
          { "name": "Primary and secondary offerings", "status": "current", "evidence": "Service catalog with pricing in operations binder, updated 2025." },
          { "name": "Pricing strategy and rationale", "status": "current", "evidence": "Pricing model document, updated annually." },
          { "name": "Competitive positioning", "status": "current", "evidence": "Competitor matrix in last quarterly review, accurate within 12 months." }
        ],
        "top_gap": "Strong USP, well-positioned vs. competitors",
        "gap_narrative": "Offering is the strongest area. The same-day service guarantee is a clear, defensible USP and shows up consistently across every customer touchpoint. Pricing is documented and rational. The owner has done the strategic work here and it shows. The only opportunity is sharper articulation of secondary services in marketing — they exist but aren't prominently positioned.",
        "evidence": [
          "Materials review: pricing strategy doc, service catalog, competitor matrix all current.",
          "Customer interview proxy: 5 of 5 reviewed reviews mention same-day service unprompted."
        ]
      },
      "communications": {
        "activity_score": 4,
        "documented_strategy": "none",
        "documented_strategy_elements": [
          { "name": "Channel strategy", "status": "missing", "evidence": "Channels are active (email, FB, GMB, website) but no documented rationale for which channels matter." },
          { "name": "Messaging framework", "status": "missing", "evidence": "No pillars, proof points, or CTAs documented." },
          { "name": "Content cadence and editorial direction", "status": "missing", "evidence": "Posts happen ad-hoc; no calendar or editorial direction." },
          { "name": "Campaign architecture", "status": "missing", "evidence": "No campaign planning documents found." }
        ],
        "top_gap": "Channels chosen ad-hoc; no editorial direction",
        "gap_narrative": "Communications activity exists but is undirected. Email goes out monthly, Facebook posts a few times a week, Google Business Profile is updated. None of it follows a documented strategy. There's no messaging framework, no editorial direction, no campaign architecture. The result: communications work consumes time without compounding. Each post starts from zero rather than building on a documented thesis about what the brand says and why.",
        "evidence": [
          "Asset crawl: 47 social posts in last 90 days, no thematic through-line.",
          "Email archive: monthly newsletter, no documented strategy for content selection."
        ]
      },
      "sales": {
        "activity_score": 3,
        "documented_strategy": "partial",
        "documented_strategy_elements": [
          { "name": "Pipeline stages and qualification", "status": "current", "evidence": "HubSpot pipeline configured with stages; sales team uses it." },
          { "name": "Sales process", "status": "stale", "evidence": "Process documented in 2023; not updated since pricing changed in 2025." },
          { "name": "Objection handling", "status": "missing", "evidence": "No documented objection-handling guidance." },
          { "name": "Marketing-to-sales handoff", "status": "missing", "evidence": "No documented handoff process. Leads are passed informally." }
        ],
        "top_gap": "Pipeline exists; no marketing handoff",
        "gap_narrative": "Sales infrastructure exists — pipeline is in HubSpot, qualifications are defined. But the sales process documentation hasn't kept up with pricing changes, and there's no documented marketing-to-sales handoff. Marketing-qualified leads sometimes get worked, sometimes don't. The technician owners running sales have strong instincts but no documented playbook. This is also the area most under-leveraged: sales has the most marketing-adjacent levers and the least marketing investment.",
        "evidence": [
          "HubSpot review: pipeline in use, 4 stages, qualification fields populated inconsistently.",
          "Intake: 'I keep meaning to update the sales doc but it's the last thing I get to.'"
        ]
      },
      "management": {
        "activity_score": 2,
        "documented_strategy": "none",
        "documented_strategy_elements": [
          { "name": "KPI and metric framework", "status": "missing", "evidence": "Financial metrics tracked; marketing metrics not formally tracked." },
          { "name": "Reporting cadence and dashboard", "status": "missing", "evidence": "No marketing dashboard. Owner reviews HubSpot ad-hoc." },
          { "name": "Marketing budget", "status": "missing", "evidence": "Marketing spend is in QuickBooks but no documented budget." },
          { "name": "Vendor and team structure", "status": "missing", "evidence": "Two contractors and one part-time staff; no documented roles or RACI." }
        ],
        "top_gap": "KPIs not tracked; no reporting cadence",
        "gap_narrative": "Management is the lowest score and the area with the highest leverage. Without documented KPIs, no honest assessment of marketing performance is possible. Without a reporting cadence, no learning loop exists. Without a documented budget, marketing spend can't be optimized. The data is mostly there — HubSpot, QuickBooks, GA4 — but nothing is being aggregated or acted on. Building this layer first makes everything else measurable.",
        "evidence": [
          "Intake: 'I look at HubSpot when I remember to.'",